{
  "access_status": "publicly_readable_license_unclear",
  "authors": [
    "Karl R. Popper"
  ],
  "id": "popper-1963-science-conjectures",
  "identifiers": {},
  "issued": "1963",
  "provenance": "source_derived",
  "publishable": true,
  "record_type": "source",
  "status": "verified",
  "title": "Science: Conjectures and Refutations",
  "url": "https://psychology.nottingham.ac.uk/staff/lpztb1/Teaching/C82MST/Popper%20%281963%29%20Science-Conjectures%20and%20refutations.pdf",
  "version_note": "Public University of Nottingham teaching copy of the chapter from Conjectures and Refutations, read in full on 2026-07-27. Used to record Popper's own demarcation criticism, not to turn that criticism into an uncontested efficacy verdict."
}
