{
  "access_status": "public_domain_fulltext",
  "authors": [
    "Sigmund Freud"
  ],
  "id": "freud-1925-three-essays-sixth",
  "identifiers": {},
  "issued": "1925",
  "provenance": "source_derived",
  "publishable": true,
  "record_type": "source",
  "status": "retrieved",
  "title": "Drei Abhandlungen zur Sexualtheorie, sixth reviewed edition",
  "url": "https://www.freudedition.net/werke/drei-abhandlungen-zur-sexualtheorie/druckschrift-4",
  "version_note": "Complete sixth reviewed German edition, Leipzig and Vienna, December 1925. The Freud Edition manifestation, contents, bibliographic record and linked scan were read on 2026-07-27; it is retained separately from the shorter 1905 first edition."
}
