{
  "access_status": "publicly_readable_license_unclear",
  "authors": [
    "Edward Bradford Titchener"
  ],
  "id": "titchener-1898-postulates-structural-psychology",
  "identifiers": {
    "doi": "10.2307/2177110"
  },
  "issued": "1898",
  "provenance": "source_derived",
  "publishable": true,
  "record_type": "source",
  "status": "retrieved",
  "title": "The Postulates of a Structural Psychology",
  "url": "https://psychclassics.yorku.ca/Titchener/structuralism.htm",
  "version_note": "First published in The Philosophical Review 7(5), September 1898, pp. 449-465. The York University Classics in the History of Psychology HTML transcription was read in full on 2026-07-26; DOI and bibliographic metadata were cross-checked against the journal/JSTOR record. No copy of the full text is stored in this repository."
}
