{
  "access_status": "public_domain_fulltext",
  "authors": [
    "Wilhelm Wundt"
  ],
  "id": "wundt-1897-outlines-psychology",
  "identifiers": {},
  "issued": "1897",
  "provenance": "source_derived",
  "publishable": true,
  "record_type": "source",
  "status": "retrieved",
  "title": "Outlines of Psychology",
  "url": "https://psychclassics.yorku.ca/Wundt/Outlines/",
  "version_note": "Charles Hubbard Judd's 1897 English translation. The York University Classics in the History of Psychology HTML transcriptions of sections 5, 8, 15 and 16 were read directly on 2026-07-27; locators retain the printed translation's section and page numbers. No copy of the full text is stored in this repository."
}
