{
  "access_status": "publicly_readable_license_unclear",
  "authors": [
    "International Psychoanalytical Association"
  ],
  "id": "ipa-what-is-psychoanalysis",
  "identifiers": {},
  "provenance": "source_derived",
  "publishable": true,
  "record_type": "source",
  "status": "retrieved",
  "title": "What is Psychoanalysis?",
  "url": "https://www.ipa.world/ipa/IPADev/Psychoanalysis/What_is_Psychoanalysis/Dev/About_Psychoanalysis/What_is_Psychoanalysis.aspx?hkey=f6804a78-88e2-4665-b41e-804be5515172",
  "version_note": "The International Psychoanalytical Association's public overview page was read in full on 2026-07-27. The page provides a contemporary institutional description; it is not treated as neutral evidence for treatment efficacy. No redistribution license or copy of the page is asserted here."
}
