{
  "access_status": "publicly_readable_license_unclear",
  "authors": ["Steven C. Hayes"],
  "id": "hayes-2004-third-wave",
  "identifiers": {"doi": "10.1016/S0005-7894(04)80013-3"},
  "issued": "2004",
  "provenance": "source_derived",
  "publishable": true,
  "record_type": "source",
  "status": "retrieved",
  "title": "Acceptance and Commitment Therapy, Relational Frame Theory, and the Third Wave of Behavioral and Cognitive Therapies",
  "url": "https://contextualscience.org/sites/default/files/318%20ACT%20RFT%20and%20the%20Third%20Wave%20BT%202004.pdf",
  "version_note": "The 28-page article was read in full on 2026-07-27. Its wave taxonomy is Hayes's organizing proposal and is not treated as an uncontested universal classification."
}
