{
  "access_status": "public_domain_fulltext",
  "authors": [
    "Edward Bradford Titchener"
  ],
  "id": "titchener-1901-experimental-psychology-manual",
  "identifiers": {
    "internet_archive": "cu31924085712192"
  },
  "issued": "1901",
  "provenance": "source_derived",
  "publishable": true,
  "record_type": "source",
  "status": "retrieved",
  "title": "Experimental Psychology: A Manual of Laboratory Practice, Volume I, Part I: Student's Manual",
  "url": "https://commons.wikimedia.org/wiki/File:Experimental_psychology_-_a_manual_of_laboratory_practice_(IA_cu31924085712192).pdf",
  "version_note": "New York and London: Macmillan, 1901. The public-domain Cornell University Library scan was downloaded temporarily and its Directions to Students section was read directly on 2026-07-27; PDF page 19 corresponds to printed p. xiii. No copy of the full text is stored in this repository."
}
