{
  "access_status": "publicly_readable_license_unclear",
  "authors": [
    "Society of Experimental Psychologists"
  ],
  "id": "society-experimental-psychologists-history",
  "identifiers": {},
  "provenance": "source_derived",
  "publishable": true,
  "record_type": "source",
  "status": "retrieved",
  "title": "History of the Society of Experimental Psychologists",
  "url": "https://www.sepsych.org/",
  "version_note": "The official society page's History of SEP and About Us sections were read directly on 2026-07-27. The page states both the 1904 founding by Titchener and the 1927 reorganization; no copy is stored in this repository."
}
