{
  "access_status": "publicly_readable_license_unclear",
  "authors": [
    "Sigmund Freud Edition"
  ],
  "id": "freud-edition-ego-id-versions",
  "identifiers": {},
  "provenance": "source_derived",
  "publishable": true,
  "record_type": "source",
  "status": "retrieved",
  "title": "Das Ich und das Es: work and translation record",
  "url": "https://www.freudedition.net/en/werke/freud-sigmund/das-ich-und-das-es",
  "version_note": "Freud Edition work-level inventory for Das Ich und das Es, including its 1923 first German publication and Joan Riviere's 1927 first English translation. The complete public version record was read on 2026-07-27."
}
