{
  "access_status": "publicly_readable_license_unclear",
  "authors": ["Guilford Press"],
  "id": "guilford-cognitive-therapy-depression-2024",
  "identifiers": {"isbn": "9781572305823"},
  "issued": "2024",
  "provenance": "source_derived",
  "publishable": true,
  "record_type": "source",
  "status": "retrieved",
  "title": "Cognitive Therapy of Depression: Second Edition",
  "url": "https://www.guilford.com/books/Cognitive-Therapy-of-Depression/Beck-Rush-Shaw-Emery/9781572305823/prior-editions",
  "version_note": "The publisher page was read in full on 2026-07-27. It identifies the 1979 first edition and the substantially rewritten 2024 second edition; it is not used for efficacy."
}
