{
  "id": "arc-indigenous-studies-for-guide",
  "record_type": "source",
  "title": "Quick Guide to Assigning Indigenous Studies FoR Codes to ERA Outputs",
  "identifiers": {},
  "access_status": "open_fulltext",
  "status": "retrieved",
  "publishable": false,
  "provenance": "reference_system",
  "authors": ["Australian Research Council"],
  "issued": "2022-07",
  "url": "https://www.arc.gov.au/sites/default/files/2022-07/quick_guide-assigning_indigenous_studies_for_codes_to_era_outputs.pdf",
  "version_note": "Official ARC guide retrieved 2026-07-23; lists all ANZSRC 2020 Division 45 Indigenous studies groups and describes the classification's broad Indigenous research definition. Its 4517/4518 Pacific Peoples ordering predates the ABS data cube corrected 2025-10-24; current labels follow the corrected cube."
}
