{
  "access_status": "publicly_readable_license_unclear",
  "authors": [
    "British Psychoanalytical Society",
    "Eleanor Sawbridge Burton"
  ],
  "issued": "2016",
  "id": "bps-ronald-fairbairn",
  "identifiers": {},
  "provenance": "source_derived",
  "publishable": true,
  "record_type": "source",
  "status": "verified",
  "title": "Ronald Fairbairn",
  "url": "https://psychoanalysis.org.uk/ronald-fairbairn",
  "version_note": "British Psychoanalytical Society public profile read in full on 2026-07-27. Used for its explicit classification of object relations as a branch of psychoanalytic theory."
}
