{
  "access_status": "public_domain_fulltext",
  "authors": [
    "Edward Bradford Titchener"
  ],
  "id": "titchener-1912-schema-introspection",
  "identifiers": {},
  "issued": "1912",
  "provenance": "source_derived",
  "publishable": true,
  "record_type": "source",
  "status": "retrieved",
  "title": "The Schema of Introspection",
  "url": "https://psychclassics.yorku.ca/Titchener/introspection.htm",
  "version_note": "First published in The American Journal of Psychology 23, pp. 485-508. The York University Classics in the History of Psychology HTML transcription was downloaded temporarily and the stimulus-error section was read directly on 2026-07-27. No copy of the full text is stored in this repository."
}
