{
  "id": "gignac-zajenkowski-2020",
  "record_type": "source",
  "title": "The Dunning-Kruger effect is (mostly) a statistical artefact: valid approaches to testing the hypothesis with individual differences data",
  "identifiers": {},
  "access_status": "paywalled_unread",
  "status": "retrieved",
  "publishable": false,
  "provenance": "source_derived",
  "authors": [
    "Gilles E. Gignac",
    "Marcin Zajenkowski"
  ],
  "issued": "2020",
  "url": "https://www.sciencedirect.com/science/article/abs/pii/S0160289620300271",
  "version_note": "Intelligence, volume 80 (2020). Landing page confirmed via search; full text not read and no confirmed DOI captured, so identifiers are left empty and access is paywalled_unread."
}
