{
  "access_status": "publicly_readable_license_unclear",
  "authors": [
    "Sigmund Freud"
  ],
  "id": "freud-1923-ego-id",
  "identifiers": {},
  "issued": "1923",
  "provenance": "source_derived",
  "publishable": true,
  "record_type": "source",
  "status": "retrieved",
  "title": "The Ego and the Id",
  "url": "https://www.lutecium.org/ftp/Freud/pdf/1923_the_ego_and_the_id.pdf",
  "version_note": "Complete English Standard Edition text of Freud's 1923 book, SE XIX, pp. 1-66. The 30-page public PDF and Freud Edition bibliographic record were read on 2026-07-27; no copy is stored in this repository and no redistribution license is asserted."
}
